{
    "$schema": "http://json-schema.org/draft-07/schema#",
    "type": "object",
    "properties": {
        "rule": {
            "type": "string",
            "const": "post"
        },
        "community": {
            "type": "string"
        },
        "field": {
            "type": "string",
            "enum": [
                "title",
                "body",
                "link"
            ]
        },
        "match": {
            "type": "string"
        },
        "type": {
            "type": "string",
            "enum": [
                "exact",
                "regex"
            ]
        },
        "whitelist": {
            "type": "boolean"
        },
        "mod_exempt": {
            "type": "boolean"
        },
        "message": {
            "type": [
                "string",
                "null"
            ]
        },
        "removal_reason": {
            "type": [
                "string",
                "null"
            ]
        }
    },
    "required": [
        "rule",
        "community",
        "field",
        "match",
        "type",
        "whitelist",
        "mod_exempt",
        "message",
        "removal_reason"
    ]
}