{
    "$schema": "https://raw.githubusercontent.com/ornato-t/lemmy-automoderator/master/src/schemas/post.json",
    "rule": "post",
    "community": "pcm",
    "field": "title",
    "type": "exact",
    "match": "ur ugly",
    "whitelist": false,
    "mod_exempt": true,
    "message": "The RoboJanny doesn't like you",
    "removal_reason": "arbitrary"
}